question,answer,keywords,topic
what is Newton's laws,"First Law (Law of Inertia): An object at rest stays at rest, and an object in motion continues in motion with the same speed and in the same direction unless acted upon by a net external force. 

Second Law (F=ma): The acceleration of an object is directly proportional to the net force acting on it and inversely proportional to its mass. This is often expressed with the formula F =ma, where F is the force, m is the mass, and a is the acceleration.

Third Law (Action and Reaction): For every action, there is an equal and opposite reaction. This means that forces always occur in pairs.",Newton law,general
Which planet is known as the Red Planet?,… Mars,which planet is known as the red planet?,general
What is the boiling point of water at sea level?,Water boils at 100°C (212°F) under standard atmospheric pressure.,what is the boiling point of water at sea level?,general
What is the main source of energy for Earth?,"The Sun provides solar energy that drives weather, photosynthesis, and life.",what is the main source of energy for earth?,general

